{
  "composition": {
    "assets": [],
    "bundles": [
      {
        "bundle_root_instance_id": "primary",
        "dependency_closure": [
          "primary"
        ],
        "members": [
          {
            "bundle_role": "root",
            "instance_id": "primary",
            "requested": true,
            "source_provenance": "requested"
          }
        ],
        "references": []
      }
    ],
    "entries": [
      {
        "bundle_role": "root",
        "bundle_root_instance_id": "primary",
        "construction_origin": "native_plan",
        "content": [
          {
            "address": {
              "element": 16,
              "group": 32736
            },
            "kind": "native_pixels",
            "placement": {
              "kind": "top_level"
            },
            "properties": {},
            "sha256": "fc79e707a60d7602732e7b610a0191cf3eb205264589af81571471727db68099",
            "size_bytes": 4096,
            "slot": "pixels",
            "vr": "OB"
          }
        ],
        "determinism": "byte_stable",
        "dicom": {
          "sop_class_uid": "1.2.840.10008.5.1.4.1.1.7",
          "transfer_syntax_uid": "1.2.840.10008.1.2.1"
        },
        "instance_id": "primary",
        "path": "instances/primary.dcm",
        "references": [],
        "requested": true,
        "resolved_attributes": [
          {
            "address": {
              "element": 5,
              "group": 8
            },
            "origin": "template_default",
            "value": {
              "kind": "primitive",
              "value": {
                "kind": "string",
                "value": "ISO_IR 192"
              }
            },
            "vr": "CS"
          },
          {
            "address": {
              "element": 22,
              "group": 8
            },
            "origin": "derived_structural",
            "value": {
              "kind": "primitive",
              "value": {
                "kind": "string",
                "value": "1.2.840.10008.5.1.4.1.1.7"
              }
            },
            "vr": "UI"
          },
          {
            "address": {
              "element": 24,
              "group": 8
            },
            "origin": "derived_structural",
            "value": {
              "kind": "primitive",
              "value": {
                "kind": "string",
                "value": "2.25.330025437847673057770667728326203097888"
              }
            },
            "vr": "UI"
          },
          {
            "address": {
              "element": 28,
              "group": 8
            },
            "origin": "derived_structural",
            "value": {
              "kind": "primitive",
              "value": {
                "kind": "string",
                "value": "YES"
              }
            },
            "vr": "CS"
          },
          {
            "address": {
              "element": 32,
              "group": 8
            },
            "origin": "template_default",
            "value": {
              "kind": "primitive",
              "value": {
                "kind": "string",
                "value": "20000101"
              }
            },
            "vr": "DA"
          },
          {
            "address": {
              "element": 35,
              "group": 8
            },
            "origin": "template_default",
            "value": {
              "kind": "primitive",
              "value": {
                "kind": "string",
                "value": "20000101"
              }
            },
            "vr": "DA"
          },
          {
            "address": {
              "element": 48,
              "group": 8
            },
            "origin": "template_default",
            "value": {
              "kind": "primitive",
              "value": {
                "kind": "string",
                "value": "000000"
              }
            },
            "vr": "TM"
          },
          {
            "address": {
              "element": 51,
              "group": 8
            },
            "origin": "template_default",
            "value": {
              "kind": "primitive",
              "value": {
                "kind": "string",
                "value": "000000"
              }
            },
            "vr": "TM"
          },
          {
            "address": {
              "element": 80,
              "group": 8
            },
            "origin": "template_default",
            "value": null,
            "vr": "SH"
          },
          {
            "address": {
              "element": 96,
              "group": 8
            },
            "origin": "template_default",
            "value": {
              "kind": "primitive",
              "value": {
                "kind": "string",
                "value": "OT"
              }
            },
            "vr": "CS"
          },
          {
            "address": {
              "element": 100,
              "group": 8
            },
            "origin": "template_default",
            "value": {
              "kind": "primitive",
              "value": {
                "kind": "string",
                "value": "WSD"
              }
            },
            "vr": "CS"
          },
          {
            "address": {
              "element": 112,
              "group": 8
            },
            "origin": "template_default",
            "value": {
              "kind": "primitive",
              "value": {
                "kind": "string",
                "value": "OpenAI"
              }
            },
            "vr": "LO"
          },
          {
            "address": {
              "element": 144,
              "group": 8
            },
            "origin": "template_default",
            "value": null,
            "vr": "PN"
          },
          {
            "address": {
              "element": 4240,
              "group": 8
            },
            "origin": "template_default",
            "value": {
              "kind": "primitive",
              "value": {
                "kind": "string",
                "value": "DICOM Test Suite"
              }
            },
            "vr": "LO"
          },
          {
            "address": {
              "element": 16,
              "group": 16
            },
            "origin": "template_default",
            "value": {
              "kind": "primitive",
              "value": {
                "kind": "string",
                "value": "DTS^Synthetic"
              }
            },
            "vr": "PN"
          },
          {
            "address": {
              "element": 32,
              "group": 16
            },
            "origin": "template_default",
            "value": {
              "kind": "primitive",
              "value": {
                "kind": "string",
                "value": "DTS-COMPOSE"
              }
            },
            "vr": "LO"
          },
          {
            "address": {
              "element": 48,
              "group": 16
            },
            "origin": "template_default",
            "value": null,
            "vr": "DA"
          },
          {
            "address": {
              "element": 64,
              "group": 16
            },
            "origin": "template_default",
            "value": null,
            "vr": "CS"
          },
          {
            "address": {
              "element": 13,
              "group": 32
            },
            "origin": "derived_structural",
            "value": {
              "kind": "primitive",
              "value": {
                "kind": "string",
                "value": "2.25.199732695774624384331568688825179981131"
              }
            },
            "vr": "UI"
          },
          {
            "address": {
              "element": 14,
              "group": 32
            },
            "origin": "derived_structural",
            "value": {
              "kind": "primitive",
              "value": {
                "kind": "string",
                "value": "2.25.71385168826793466491224843263973851780"
              }
            },
            "vr": "UI"
          },
          {
            "address": {
              "element": 16,
              "group": 32
            },
            "origin": "template_default",
            "value": {
              "kind": "primitive",
              "value": {
                "kind": "string",
                "value": "DTS-STUDY"
              }
            },
            "vr": "SH"
          },
          {
            "address": {
              "element": 17,
              "group": 32
            },
            "origin": "template_default",
            "value": {
              "kind": "primitive",
              "value": {
                "kind": "string",
                "value": "1"
              }
            },
            "vr": "IS"
          },
          {
            "address": {
              "element": 19,
              "group": 32
            },
            "origin": "template_default",
            "value": {
              "kind": "primitive",
              "value": {
                "kind": "string",
                "value": "1"
              }
            },
            "vr": "IS"
          },
          {
            "address": {
              "element": 32,
              "group": 32
            },
            "origin": "template_default",
            "value": null,
            "vr": "CS"
          },
          {
            "address": {
              "element": 96,
              "group": 32
            },
            "origin": "template_default",
            "value": {
              "kind": "primitive",
              "value": {
                "kind": "string",
                "value": "R"
              }
            },
            "vr": "CS"
          },
          {
            "address": {
              "element": 2,